NAME,TOKENS
Раскол на Украине: посмотреть правде в глаза,"раскол,украин,посмотрет,правд,глаз"
Порошенко рассказал,"порошенк,рассказыва"
КРЕМЛЬ РАСПОЯСАЛСЯ,"кремл,распоясыва"
ДЛЯ ПАЦИЕНТОВ ЖИТОМИРСКОГО ПСИХИАТРИЧЕСКОГО ДИСПАНСЕРА,"пациент,житомирск,психиатрическ,диспансер"
СБУ запретили проез Донецкого митрополита,"сбу,запреща,проез,донецк,митропол"
"Владимир Малинкович: Тема томоса и ""поместной церкви"" Запад совершенно не интересует","владимир,малинкович,тем,томос,поместн,церков,запад,совершен,интересова"
Пациент-2019,пациент
"Нетрадиционные отцы украинской ""поместной церкви""","нетрадицион,отец,украинск,поместн,церков"
"РПЦ: Упразднение ""русского экзархата"" в Европе – это уничтожение церковного единства","рпц,упразднен,русск,экзархат,европ,уничтожен,церковн,единств"
"Украинский ПУПЕЦ ударил по лбу ""томос невезения"" (Руслан Осташко)","украинск,пупец,ударя,лоб,томос,невезен,русла,осташк"
"Запад может ""утопить"" Порошенко и в Азовском море","запад,моч,утаплива,порошенк,азовск,мор"
"Кому на Украине нужен ""Томос""?","украин,нужн,томос"
"Грабёж церквей УПЦ - радикалы уже на ""низком старте""","граб,церков,упц,радика,низк,старт"
Российская агрессия в Азовском море. Почему это касается Европы? (Le Huffington Post),"российск,агресс,азовск,мор,поч,эт,каса,европ,le,huffington,post"
Александр Роджерс: Оккупацию,"александр,роджерс,оккупац"
Полумеры Запада для Петра Порошенко вызывают его агрессивность,"полумер,запад,петр,порошенк,вызыва,агрессивн"
ВОЗМОЖНО ЮЛЮ БУДУТ БИТЬ,"возможн,юл,бит"
Побои,побо
"Протоиерей Николай Балашов: ""Объединительный собор""","протоиер,никола,балаш,объединительн,собор"
"Порошенко и ""агенты Кремля"" в рясах. Отступать некуда","порошенк,агент,кремл,ряс,отступа,некуд"
"Порошенко и ""агенты Кремля"" в рясах. Отступать некуда","порошенк,агент,кремл,ряс,отступа,некуд"
РПЦ: ересь Константинополя разбилась о принципиальность УПЦ МП,"рпц,ер,константинопол,разбива,принципиальн,упц,мп"
"Порошенко и ""агенты Кремля"" в рясах. Отступать ему некуда","порошенк,агент,кремл,ряс,отступа,некуд"
"Глава одесского ""евромайдана"" призвал к войне с Россией","глав,одесск,евромайда,призыва,войн,росс"
Порошенко начал захваты православных святынь,"порошенк,начина,захват,православн,святын"
РПЦ возложила на Константинополь ответственность за гонения на украинскую церковь,"рпц,возлага,константинопол,ответствен,гонен,украинск,церков"
"Синод Константинопольского патриархата не смог назначить дату ""объединительного"" собора украинских раскольников","синод,константинопольск,патриархат,смоч,назнача,дат,объединительн,собор,украинск,раскольник"
Украина показывает Путину ночной кошмар. И вполне успешно,"украин,показыва,путин,ночн,кошмар,вполн,успешн"
В РПЦ прокомментировали обыски в Киево-Печерской Лавре,"рпц,прокомментирова,обыск,киев,печерск,лавр"
Режим Порошенко объявил войну украинскому православию,"реж,порошенк,объявля,войн,украинск,православ"
УПЦ: Порошенко надо судить за разжигание межрелигиозной розни,"упц,порошенк,суд,разжиган,межрелигиозн,розн"
Почему на Украине невозможны перемены? Во всяком случае,"поч,украин,невозможн,перем,всяк,случа"
СБУ пришла с обыском к наместнику Киево-печерской Лавры. Выбивают согласие на Томос?,"сбу,приход,обыск,наместник,киев,печерск,лавр,выбива,соглас,томос"
Константинопольский рейдер Варфоломей,"константинопольск,рейдер,варфолом"
ПОКА НЕ ВЫЛЬЕТСЯ В ОТКРЫТУЮ ТЕРРОРИСТИЧЕСКУЮ ДИКТАТУРУ,"пок,вылива,открыт,террористическ,диктатур"
Константинополь ликвидировал Западноевропейский экзархат русских приходов,"константинопол,ликвидирова,западноевропейск,экзархат,русск,приход"
Константинополь распускает Западноевропейский экзархат русских приходов - СМИ,"константинопол,распуска,западноевропейск,экзархат,русск,приход,сми"
Константинополь ликвидировал Западноевропейский экзархат русских приходов,"константинопол,ликвидирова,западноевропейск,экзархат,русск,приход"
В Ровно патриоты обвинили УПЦ в пытках украинских моряков и облили краской дверь епархии,"ровн,патриот,обвиня,упц,пытк,украинск,моряк,облива,краск,двер,епарх"
СМИ: Константинополь распустил русские приходы в Западной Европе,"сми,константинопол,распуска,русск,приход,западн,европ"
В Ровно патриоты обвинили УПЦ в пытках украинских моряков и облили краской дверь епархии,"ровн,патриот,обвиня,упц,пытк,украинск,моряк,облива,краск,двер,епарх"
Пётр Порошенко и старт предпоследнего этапа,"п,тр,порошенк,старт,предпоследн,этап"
Ляшко заблокировал трибуну: заседание Верховной Рады о введении военного положения на Украине началось со скандала,"ляшк,заблокирова,трибун,заседан,верховн,рад,введен,воен,положен,украин,начина,сканда"
Военное положение на Украине — способ решения проблемы удержания власти,"воен,положен,украин,способ,решен,проблем,удержан,власт"
Классическая агония,"классическ,агон"
Военное положение на Украине - способ решения проблемы удержания власти,"воен,положен,украин,способ,решен,проблем,удержан,власт"
Порошенко ударили под дых накануне автокефалии,"порошенк,ударя,дых,наканун,автокефал"
Зима уж близится,"зим,близ"
Последний шанс для бабушки: Киев наводнила антиреклама Тимошенко,"последн,шанс,бабушк,ки,наводня,антиреклам,тимошенк"
"Подонки! Твари!: ветеран ""АТО"" говорит правду об украинской власти","подонок,твар,ветера,ат,говор,правд,украинск,власт"
"Подонки! Твари!: ветеран ""АТО"" говорит правду об украинской власти (ВИДЕО)","подонок,твар,ветера,ат,говор,правд,украинск,власт,виде"
Нас бомбила Украина,"бомб,украин"
Дела автокефальные: поклонник Мазепы может получить томос в Украине,"дел,автокефальн,поклонник,мазеп,моч,получа,томос,украин"
"Украинские раскольники опровергли сообщения о дате ""объединительного собора""","украинск,раскольник,опроверга,сообщен,дат,объединительн,собор"
"Филарет предложил кандидата на пост главы новой украинской ""церкви""","филарет,предлага,кандидат,пост,глав,нов,украинск,церков"
Украина - только начало: что будет с православными церквями Прибалтики и Беларуси,"украин,нача,православн,церков,прибалтик,белар"
Бывший АТОшник высказал мнение о нынешней власти на Украине,"бывш,атошник,высказыва,мнен,нынешн,власт,украин"
Из каких епископов пытаются создать единую церковь на Украине,"епископ,пыта,создава,един,церков,украин"
Судьба украинского раскола в руках порошенковского Гестапо,"судьб,украинск,раскол,рук,порошенковск,гестап"
На тризубе поставили крест: В Сети обсуждают странные конструкции на Майдане (ФОТО),"тризуб,поставля,крест,сет,обсужда,стран,конструкц,майда,фот"
Вселенский патриархат объявит дату вручения томоса украинским раскольникам в декабре,"вселенск,патриархат,объявля,дат,вручен,томос,украинск,раскольник,декабр"
"Филарет предложил кандидата на пост главы новой украинской ""церкви""","филарет,предлага,кандидат,пост,глав,нов,украинск,церков"
"В Запорожье сторонники Томоса призвали гнать ""церковных агентов Кремля"" из Украины","запорож,сторонник,томос,призыва,гнат,церковн,агент,кремл,украин"
"В Запорожье сторонники Томоса призвали гнать ""церковных агентов Кремля"" из Украины","запорож,сторонник,томос,призыва,гнат,церковн,агент,кремл,украин"
ПОСЛЕДНИЕ СВОДКИ — 19.11.2018 (ОБНОВЛЯЕТСЯ!),"последн,сводк,обновля"
Ищенко: Любой перешедший на сторону Порошенко епископ поставит себя вне церкви,"ищенк,люб,переход,сторон,порошенк,епископ,поставля,вне,церков"
Ищенко: Любой перешедший на сторону Порошенко епископ поставит себя вне церкви,"ищенк,люб,переход,сторон,порошенк,епископ,поставля,вне,церков"
КАРТОЧНЫЙ ДОМИК ПЕТРА АЛЕКСЕЕВИЧА РАЗРУШЕН,"карточн,домик,петр,алексеевич,разруша"
СМИ: глава канонической Украинской православной церкви Онуфрий дал отпор ереси Порошенко,"сми,глав,каноническ,украинск,православн,церков,онуфр,дава,отпор,ер,порошенк"
"Стала известна предполагаемая дата ""объединительного собора"" на Украине","станов,известн,предполага,дат,объединительн,собор,украин"
"Украинские раскольники признали заминку с проведением ""объединительного"" собора и получением томоса","украинск,раскольник,признава,заминк,проведен,объединительн,собор,получен,томос"
Украинские раскольники не смогли назвать дату получения томоса об автокефалии,"украинск,раскольник,смоч,называ,дат,получен,томос,автокефал"
"Распад карточного домика ""томосятины""","распад,карточн,домик,томосятин"
"Распад карточного домика ""томосятины""","распад,карточн,домик,томосятин"
И томос светится в дыму...: Интернет смеётся над авариями на теплосетях Киева (ФОТО),"томос,свет,дым,интернет,сме,тся,авар,теплосет,ки,фот"
Томос для Украины: в Киев едет ревизор из Константинополя,"томос,украин,ки,еха,ревизор,константинопол"
Варфоломей пообещал Украине автокефалию к годовщине голодомора,"варфолом,пообеща,украин,автокефал,годовщин,голодомор"
Томосом по голове и надеждам,"томос,голов,надежд"
Варфоломей пообещал Украине автокефалию к годовщине голодомора,"варфолом,пообеща,украин,автокефал,годовщин,голодомор"
Томосом по голове и надеждам,"томос,голов,надежд"
"Священник Андрей Ткачев: ""Епископы УПЦ указали раскольникам их место!""","священник,андр,ткач,епископ,упц,указыва,раскольник,мест"
Порошенко разочаровал Варфоломея из Стамбула,"порошенк,разочаровыва,варфолом,стамбул"
ПОСЛЕДНИЕ СВОДКИ — 14.11.2018 (ОБНОВЛЯЕТСЯ!),"последн,сводк,обновля"
Раскол Оппоблока: План Порошенко сводит на нет партии юго-востока,"раскол,оппоблок,план,порошенк,свод,парт,юг,восток"
Раскол Оппоблока: План Порошенко сводит на нет партии юго-востока,"раскол,оппоблок,план,порошенк,свод,парт,юг,восток"
Константинополь не услышал просьбы верующих Украины не узаконивать раскольников - УПЦ,"константинопол,услыша,просьб,вер,украин,узаконива,раскольник,упц"
УПЦ МП заявила о невозможности присоединения к автокефальной церкви,"упц,мп,заявля,невозможн,присоединен,автокефальн,церков"
Константинополь не услышал просьбы верующих Украины не узаконивать раскольников — УПЦ,"константинопол,услыша,просьб,вер,украин,узаконива,раскольник,упц"
УПЦ сообщила о невозможности присоединения к автокефальной церкви,"упц,сообща,невозможн,присоединен,автокефальн,церков"
Время томоса: Кризис назрел,"врем,томос,кризис,назрева"
Советник Порошенко: УПЦ МП – слаба и не сможет выступить против президента,"советник,порошенк,упц,мп,слаб,смоч,выступа,прот,президент"
ДАВАЙТЕ ПОСМОТРИМ НА ОБЩУЮ КАРТИНУ С ВЫСОТЫ ГОЛУБИНОГО ПОМЕТА,"дава,посмотрет,общ,картин,высот,голубин,помет"
ВЫБОРЫ В БУДУЩЕМ ГОДУ ПРОВОДИТЬ НЕ НАДО,"выбор,будущ,год,провод"
Время томоса: Кризис назрел,"врем,томос,кризис,назрева"
Украина: почему бегут крысы?,"украин,поч,бежа,крыс"
Парижский прорыв в Булонском лесу,"парижск,прор,булонск,лес"
Украина: почему бегут крысы?,"украин,поч,бежа,крыс"
Архиепископ Климент: Украинская православная церковь получила название раньше,"архиепископ,климент,украинск,православн,церков,получа,назван,ран"
Раскольники Филарет и Макарий отреклись от руководства автокефальной церковью,"раскольник,филарет,макар,отрека,руководств,автокефальн,церков"
До Фанара,фанар
ПУСТЬ ХОТЬ ОНИ СМОГУТ ЖИТЬ ПО-ЧЕЛОВЕЧЕСКИ,"пуст,смоч,жит,человеческ"
Нечисть правит Украиной,"нечист,прав,украин"
НОВОСТИ от ANNA NEWS на 18-00 7 ноября 2018 года || Порошенко выгоняет представителей РПЦ,"новост,anna,news,ноябр,год,порошенк,выгоня,представител,рпц"
Предвыборная схватка: проститутки против пид…сов,"предвыборн,схватк,проститутк,прот,пид,сов"
ПРОСТИТУТКИ С ПИДАРАСАМИ ДЕРУТСЯ,"проститутк,пидарас,драт"
Предвыборная схватка: проститутки против пид…сов,"предвыборн,схватк,проститутк,прот,пид,сов"
"Парубий назвал срок проведения ""объединительного собора"" украинских раскольников","паруб,называ,срок,проведен,объединительн,собор,украинск,раскольник"
"Кто кому доктор. ""Сбитый летчик"" Филарет и раскольник-узурпатор Варфоломей","доктор,сбива,летчик,филарет,раскольник,узурпатор,варфолом"
Порошенко и Варфоломей окончательно предали единство мирового православия,"порошенк,варфолом,окончательн,предава,единств,миров,православ"
ИГОРЬ КОЛОМОЙСКИЙ НАГАДИЛ НА ПРАЗДНИК НАЦИИ,"игор,коломойск,нагад,праздник,нац"
Гибридные санкции Путина,"гибридн,санкц,путин"
Дела раскольнические. Порошенко и Варфоломей ударили по рукам,"дел,раскольническ,порошенк,варфолом,ударя,рук"
СПЕЦОПЕРАЦИЯ ФСБ,"спецоперац,фсб"
Рожденные в СССР: санкционный список Кремля,"рожа,ссср,санкцион,список,кремл"
Патриарх Кирилл: Украинские власти не смогут разорвать духовную общность народов,"патриарх,кирилл,украинск,власт,смоч,разрыва,духовн,общност,народ"
Рожденные в СССР: санкционный список Кремля,"рожа,ссср,санкцион,список,кремл"
Четыре барьера на пути к томосу,"четыр,барьер,пут,томос"
Как нам наступать на Фанар,"наступа,фанар"
Теперь уже виноват российский орёл,"виноват,российск,ор,л"
Вадим Карасев: В действиях Порошенко нет солидарности с народом,"вад,карас,действ,порошенк,солидарн,народ"
Павел Раста: Самоопределившиеся,"павел,раст,самоопределя"
Вадим Карасев: В действиях Порошенко нет солидарности с народом,"вад,карас,действ,порошенк,солидарн,народ"
Мы на пороге катастрофы,"порог,катастроф"
Митрополит Онуфрий отказался отпевать раскольников,"митропол,онуфр,отказыва,отпева,раскольник"
Ищенко: Украина останется без томоса из-за амбиций Филарета и Варфоломея,"ищенк,украин,остава,томос,амбиц,филарет,варфолом"
Зачем политикам-иноверцам Томос об автокефалии?,"политик,иноверец,томос,автокефал"
Варфоломей и его западные кураторы создают антитезу христианству.,"варфолом,западн,куратор,создава,антитез,христианств"
Если нападут националисты,"нападыва,националист"
Раскол русского православия — геополитическая катастрофа сравнимая с распадом СССР. Интервью с Олегом Царевым,"раскол,русск,православ,геополитическ,катастроф,сравним,распад,ссср,интерв,олег,цар"
Раскол русского православия - геополитическая катастрофа сравнимая с распадом СССР. Интервью с Олегом Царевым,"раскол,русск,православ,геополитическ,катастроф,сравним,распад,ссср,интерв,олег,цар"
Филарет не хочет обсуждать разногласия среди раскольников до Собора,"филарет,хотет,обсужда,разноглас,сред,раскольник,собор"
Иерусалимский патриархат принял сторону Константинополя в конфликте с РПЦ,"иерусалимск,патриархат,принима,сторон,константинопол,конфликт,рпц"
Глава УПЦ: Предоставление томоса породит новые расколы внутри православия,"глав,упц,предоставлен,томос,порожда,нов,раскол,внутр,православ"
Византийские игры патриарха Варфоломея,"византийск,игр,патриарх,варфолом"
Первый штурм православия не удался. Киев и Фанар приступили к правильной осаде,"перв,штурм,православ,удава,ки,фанар,приступа,правильн,осад"
