NAME,TOKENS
"Владимир Путин назвал создание новой Церкви на Украине ""опасным политиканством""","владимир,путин,называ,создан,нов,церков,украин,опасн,политиканств"
"Интервью сербским изданиям ""Политика"" и ""Вечерние новости""","интерв,сербск,издан,политик,вечерн,новост"
Томос для Украины нивелирует понятие автокефалии,"томос,украин,нивелирова,понят,автокефал"
До выборов в президенты на Украине два с половиной месяца,"выбор,президент,украин,половин,месяц"
Итоги недели: версии убийства в ЦАР и откровения хакера,"итог,недел,верс,убийств,цар,откровен,хакер"
Власти Украины продолжают давить на паству и монахов Киево-Печерской лавры,"власт,украин,продолжа,дав,паств,мон,киев,печерск,лавр"
Минкульт Украины хочет дискредитировать УПЦ слухами о пропаже икон,"минкульт,украин,хотет,дискредитирова,упц,слух,пропаж,икон"
Порошенко сравнил получение томоса с победой на фронте,"порошенк,сравнива,получен,томос,побед,фронт"
Украинцы потеряли томос,"украинец,потеря,томос"
Братии Киево-Печерской лавры предложили перейти в ПЦУ,"брат,киев,печерск,лавр,предлага,переход,пцу"
К политическим казусам не причастны: Наместник Киево-Печерской лавры выступил перед журналистами,"политическ,казус,причастн,наместник,киев,печерск,лавр,выступа,журналист"
Один на троих. Гриценко,"тро,гриценк"
Реалистичный взгляд на Россию из Грузии,"реалистичн,взгляд,росс,груз"
Порошенко озвучил свою цель на второй президентский срок,"порошенк,озвучива,сво,цел,втор,президентск,срок"
Порошенко пообещал защиту сторонникам канонической церкви,"порошенк,пообеща,защит,сторонник,каноническ,церков"
Порошенко призвал неверующих в томос покаяться,"порошенк,призыва,невер,томос,покая"
Томос-тур в Луцке: Порошенко приехал в храм с опозданием,"томос,тур,луцк,порошенк,приезжа,храм,опоздан"
"Порошенко обвинил УПЦ в создании ""пятой колонны""","порошенк,обвиня,упц,создан,пят,колон"
"Золотарев: После ""томос-тура"" клоуном на Украине стал Порошенко","золотар,томос,тур,клоун,украин,станов,порошенк"
"Томос об автокефалии ""новой церкви"" Украины привезли в Луцк","томос,автокефал,нов,церков,украин,привоз,луцк"
"Украинские выборы: Порошенко на дне и ""пластическая операция"" для Яценюка","украинск,выбор,порошенк,дно,пластическ,операц,яценюк"
Луценко: Около 70 приходов перешло из Украинской православной церкви в ПЦУ,"луценк,окол,приход,переход,украинск,православн,церков,пцу"
Он лжец. Иерусалимский патриарх защитил Тимошенко от обвинений Ющенко,"лжец,иерусалимск,патриарх,защища,тимошенк,обвинен,ющенк"
Порошенко укрепляет украинцев духовно,"порошенк,укрепля,украинец,духовн"
В Раде требуют изменить закон о церквях,"рад,требова,изменя,закон,церков"
Выпуск новостей в 12:00 от 15.01.2019,"выпуск,новост"
Константинопольский патриархат наконец-то опубликовал пресловутый томос об автокефалии Православной церкви Украины,"константинопольск,патриархат,опубликовыва,пресловут,томос,автокефал,православн,церков,украин"
Раскольники атакуют Юго-Восток Украины,"раскольник,атакова,юг,восток,украин"
Церковный закон на Украине позволит приходам избежать даления — эксперт,"церковн,закон,украин,позволя,приход,избега,дален,эксперт"
В РПЦ посоветовали Порошенко сменить консультантов по церковной истории,"рпц,посоветова,порошенк,смен,консультант,церковн,истор"
Тимошенко оценила шансы Порошенко на выборах,"тимошенк,оценива,шанс,порошенк,выбор"
В Стамбуле опубликован текст томоса об автокефалии Православной церкви Украины,"стамбул,опубликовыва,текст,томос,автокефал,православн,церков,украин"
Обнародован текст томоса об украинской автокефалии,"обнародова,текст,томос,украинск,автокефал"
"Непредсказуемые сроки. Лукашенко готовит Белоруссию к ""пробе на зуб""","непредсказуем,срок,лукашенк,готов,белорусс,проб,зуб"
Константинополь опубликовал текст томоса неканонической церкви Украины,"константинопол,опубликовыва,текст,томос,неканоническ,церков,украин"
Чем страшен томос. Национализм как украинская национальная религия,"страшн,томос,национализм,украинск,национальн,религ"
Тимошенко назвала томос об автокефалии инструментом борьбы за власть,"тимошенк,называ,томос,автокефал,инструмент,борьб,власт"
Гольдарб: Томос не заменит миллионов украинцев,"гольдарб,томос,заменя,миллион,украинец"
Опубликован текст томоса об автокефалии ПЦУ,"опубликовыва,текст,томос,автокефал,пцу"
Вселенский патриархат обнародовал текст томоса об автокефалии ПЦУ,"вселенск,патриархат,обнародова,текст,томос,автокефал,пцу"
"Опубликован текст томоса об автокефалии украинской ""новой церкви""","опубликовыва,текст,томос,автокефал,украинск,нов,церков"
Вселенский патриархат опубликовал текст томоса об автокефалии ПЦУ,"вселенск,патриархат,опубликовыва,текст,томос,автокефал,пцу"
Эксперт: томос для ПЦУ содержит признаки митрополии при Константинополе,"эксперт,томос,пцу,содержа,признак,митропол,константинопол"
Эксперт: текст томоса об автокефалии не говорит о создании поместной церкви на Украине,"эксперт,текст,томос,автокефал,говор,создан,поместн,церков,украин"
Опубликован текст томоса об автокефалии украинской церкви,"опубликовыва,текст,томос,автокефал,украинск,церков"
В Константинополе опубликовали томос об автокефалии Православной церкви Украины,"константинопол,опубликовыва,томос,автокефал,православн,церков,украин"
Обнародован томос об автокефалии ПЦУ,"обнародова,томос,автокефал,пцу"
Константинопольский патриархат опубликовал томос об автокефалии новой церкви Украины,"константинопольск,патриархат,опубликовыва,томос,автокефал,нов,церков,украин"
На Украине канонических православных священников изгоняют из храмов при помощи радикалов,"украин,каноническ,православн,священник,изгоня,храм,помощ,радика"
Новая церковь Украины заявила,"нов,церков,украин,заявля"
Украинский эксперт: исчезновение УПЦ на Украине займёт более 5 лет,"украинск,эксперт,исчезновен,упц,украин,за,т,год"
Томос нужен Порошенко для того,"томос,нужн,порошенк"
Чудо второго срока: Порошенко на выборы нужен религиозный конфликт,"чуд,втор,срок,порошенк,выбор,нужн,религиозн,конфликт"
Томос об автокефалии не подписала половина Синода Константинопольского патриархата,"томос,автокефал,подписыва,половин,синод,константинопольск,патриархат"
Неблагонадёжная Украина. Промышленные регионы смотрят на Киев с отвращением,"неблагонад,жна,украин,промышлен,регион,смотрет,ки,отвращен"
Украинский томос даровали раскольникам — представитель Константинополя,"украинск,томос,дарова,раскольник,представител,константинопол"
РПЦ теряет хватку: о дискуссии с Порошенко показать томос,"рпц,теря,хватк,дискусс,порошенк,показыва,томос"
Небоженко: Порошенко сделает всё,"небоженк,порошенк,сдела,вс"
Митрополит Иларион сравнил ОВЦС с армией,"митропол,иларион,сравнива,овцс,арм"
Глава администрации Порошенко усомнился в его будущей победе,"глав,администрац,порошенк,усомн,будущ,побед"
Безбожника Порошенко ткнули носом в его грехи,"безбожник,порошенк,ткнут,нос,грех"
"У политтехнологов Банковой кризис жанра — Корнейчук о ""томос-туре"" Порошенко","политтехнолог,банков,кризис,жанр,корнейчук,томос,тур,порошенк"
Томос-тур Порошенко. Президент Украины в роли звезды эстрады,"томос,тур,порошенк,президент,украин,рол,звезд,эстрад"
Стало известно,"станов,известн"
Томос об автокефалии служит интересам Банковой — вице-спикер Рады,"томос,автокефал,служ,интерес,банков,виц,спикер,рад"
"Русская православная церковь ответила на требование Порошенко ""показать свой томос""","русск,православн,церков,отвеча,требован,порошенк,показыва,сво,томос"
"Вице-спикер Рады обвинила Порошенко в ""безбожном"" использовании томоса для агитации","виц,спикер,рад,обвиня,порошенк,безбожн,использован,томос,агитац"
РПЦ опасается за судьбу монахов канонической Украинской православной церкви,"рпц,опаса,судьб,мон,каноническ,украинск,православн,церков"
Япония и США тренируются захватывать острова: Радио REGNUM,"япон,сша,тренирова,захватыва,остр,рад,regnum"
"Киев может ""насильно"" забирать церкви у УПЦ — эксперт","ки,моч,насильн,забира,церков,упц,эксперт"
"На Украине появились рекламные щиты с ""церковной"" агитацией за Порошенко","украин,появля,рекламн,щит,церковн,агитац,порошенк"
Дипломат обвинил Порошенко в томос-коррупции,"дипломат,обвиня,порошенк,томос,коррупц"
"В Германии осудили угрозы посла США ввести санкции за ""Северный поток-2""","герман,осужда,угроз,посол,сша,ввод,санкц,северн,поток"
Украинских раскольников не позвали на вручение томоса из-за Филарета — УАПЦ,"украинск,раскольник,позва,вручен,томос,филарет,уапц"
"Порошенко наградил трех митрополитов ""новой церкви"" Украины","порошенк,награжда,митропол,нов,церков,украин"
Порошенко подняли на смех за его обращение к РПЦ,"порошенк,подыма,смех,обращен,рпц"
"РПЦ: Порошенко намерен стать ""религиозным лидером"" Украины","рпц,порошенк,намер,станов,религиозн,лидер,украин"
В Волынской области раскольники захватили храм УПЦ,"волынск,област,раскольник,захват,храм,упц"
"В Сети высмеяли предвыборный ""томос-тур"" Порошенко","сет,высмеива,предвыборн,томос,тур,порошенк"
Порт в Измаиле. Украина избавляется от своего самого ценного актива в Бессарабии,"порт,изма,украин,избавля,сво,цен,акт,бессараб"
В Московском патриархате ответили на призыв Порошенко показать томос РПЦ,"московск,патриархат,отвеча,приз,порошенк,показыва,томос,рпц"
"Состоится ли ""православный триумвират"" Москва-Варшава-Белград?","состоя,православн,триумвират,москв,варшав,белград"
"В Сети высмеяли ""томос-тур"" Порошенко по Украине","сет,высмеива,томос,тур,порошенк,украин"
В РПЦ не намерены дискутировать с Порошенко о томосе,"рпц,намер,дискутирова,порошенк,томос"
В РПЦ отреагировали на требование Порошенко показать томос,"рпц,отреагирова,требован,порошенк,показыва,томос"
РПЦ не собирается дискутировать с Порошенко,"рпц,собира,дискутирова,порошенк"
В УПЦ признали отсутствие томоса у РПЦ,"упц,признава,отсутств,томос,рпц"
"Потребовавшего РПЦ ""показать томос"" Порошенко осадили","потребова,рпц,показыва,томос,порошенк,осажда"
В РПЦ ответили на выпад Порошенко,"рпц,отвеча,выпад,порошенк"
"Порошенко попросил РПЦ ""показать свой томос""","порошенк,попрос,рпц,показыва,сво,томос"
"В РПЦ ответили на требование Порошенко ""показать томос""","рпц,отвеча,требован,порошенк,показыва,томос"
"В УПЦ МП ответили на требование Порошенко ""показать томос""","упц,мп,отвеча,требован,порошенк,показыва,томос"
Петр Порошенко хочет передать одну из древнейших церквей Спаса на Берестове Константинопольскому Патриархату,"петр,порошенк,хотет,передава,древн,церков,спас,берест,константинопольск,патриархат"
В РПЦ ответили на призыв Порошенко показать томос,"рпц,отвеча,приз,порошенк,показыва,томос"
"Порошенко потребовал от РПЦ показать ""свой томос""","порошенк,потребова,рпц,показыва,сво,томос"
Порошенко предложил РПЦ доказать каноничность и показать томос,"порошенк,предлага,рпц,доказыва,каноничн,показыва,томос"
"Порошенко призвал РПЦ ""показать томос""","порошенк,призыва,рпц,показыва,томос"
Порошенко пытается мериться томосами,"порошенк,пыта,мер,томос"
Порошенко поставил под вопрос каноничность РПЦ,"порошенк,поставля,вопрос,каноничн,рпц"
Националисты захватили православный храм на западе Украины,"националист,захват,православн,храм,запад,украин"
Порошенко предложил РПЦ доказать свою каноничность,"порошенк,предлага,рпц,доказыва,сво,каноничн"
Украинские раскольники захватили Свято-Михайловский храм,"украинск,раскольник,захват,свят,михайловск,храм"
"В Госдуме прокомментировали заявления Порошенко о ""неканоничности"" РПЦ","госдум,прокомментирова,заявлен,порошенк,неканоничн,рпц"
За томос Константинополю отдадут храм с усыпальницей Юрия Долгорукого,"томос,константинопол,отдава,храм,усыпальниц,юр,долгорук"
"Порошенко заявил о снятии ""московского ярма"" с Украины","порошенк,заявля,снят,московск,ярм,украин"
На западе Украины раскольники захватили храм УПЦ,"запад,украин,раскольник,захват,храм,упц"
Порошенко подверг сомнению каноничность РПЦ,"порошенк,подверга,сомнен,каноничн,рпц"
Порошенко заявил о невозможности остановить Украину,"порошенк,заявля,невозможн,останавлива,украин"
Порошенко чуть не уронил томос,"порошенк,урон,томос"
Порошенко рассказал,"порошенк,рассказыва"
Порошенко уверен,"порошенк,уверен"
Порошенко возгордился снимающей московское ярмо Украиной,"порошенк,возгорд,снима,московск,ярм,украин"
Ради томоса Порошенко превратил храмы в разменную монету,"рад,томос,порошенк,превраща,храм,размен,монет"
Храмы для Порошенко стали разменной монетой - депутат Госдумы,"храм,порошенк,станов,размен,монет,депутат,госдум"
Порошенко превратил храмы на Украине в разменную монету,"порошенк,превраща,храм,украин,размен,монет"
"В Госдуме Порошенко обвинили в ""сектантстве"" и ""бездуховности""","госдум,порошенк,обвиня,сектантств,бездуховн"
Порошенко привез томос в Винницу,"порошенк,привоз,томос,винниц"
Порошенко привез томос об автокефалии в Винницу,"порошенк,привоз,томос,автокефал,винниц"
Порошенко привез томос об автокефалии в Винницу,"порошенк,привоз,томос,автокефал,винниц"
"Порошенко: Украина сняла ""ярмо"" Московского патриархата","порошенк,украин,снима,ярм,московск,патриархат"
Петр Порошенко начал возить томос об автокефалии ПЦУ по Украине,"петр,порошенк,начина,воз,томос,автокефал,пцу,украин"
Порошенко привез томос в Винницу,"порошенк,привоз,томос,винниц"
Порошенко заявил,"порошенк,заявля"
На Украине появились билборды,"украин,появля,билборд"
Порошенко помолился за обменянный на храм и разрекламированный томос,"порошенк,помол,обменя,храм,разрекламирова,томос"
Стало известно,"станов,известн"
Порошенко прибыл в Винницу со своим томос-туром,"порошенк,прибыва,винниц,сво,томос,тур"
Украинские СМИ сообщают о возможной передаче Константинополю храма в Киеве,"украинск,сми,сообща,возможн,передач,константинопол,храм,ки"
Порошенко хочет передать Варфоломею храм,"порошенк,хотет,передава,варфолом,храм"
СМИ: Порошенко отдаст Константинополю храм с могилой основателя Москвы,"сми,порошенк,отдава,константинопол,храм,мог,основател,москв"
Порошенко захотел передать Константинополю храм с могилой основателя Москвы,"порошенк,захотет,передава,константинопол,храм,мог,основател,москв"
Порошенко отдаст Константинополю церковь с могилой основателя Москвы,"порошенк,отдава,константинопол,церков,мог,основател,москв"
"Аналитическая программа ""Однако"" с Михаилом Леонтьевым","аналитическ,программ,однак,миха,леонт"
Константинополь назначил главу киевской ставропигии,"константинопол,назнача,глав,киевск,ставропиг"
