NAME,TOKENS
"Предстоятель УПЦ рассказал о ""Томосе рабства"" ПЦУ и предрек ее переход под омофор Папы Римского","предстоятел,упц,рассказыва,томос,рабств,пцу,предрека,переход,омофор,пап,римск"
"Томос рабства. Глава УПЦ высказался об ""автокефалии ПЦУ""","томос,рабств,глав,упц,высказыва,автокефал,пцу"
Новое падение Константинополя: Украинские раскольники осквернили пещеру Апокалипсиса,"нов,паден,константинопол,украинск,раскольник,оскверня,пещер,апокалипсис"
Предстоятель УПЦ митрополит Онуфрий резко отверг идею о компромиссе с раскольниками,"предстоятел,упц,митропол,онуфр,резк,отверга,иде,компромисс,раскольник"
Внешний облик Порошенко в монастыре высмеяли в web-сети,"внешн,облик,порошенк,монастыр,высмеива,web,сет"
Вынашивает томос или украл икону: в Сети смеются над Порошенко в странном пиджаке (+ВИДЕО,"вынашива,томос,украст,икон,сет,смея,порошенк,стран,пиджак,виде"
"У Порошенко есть план ""П"" — что бы это значило","порошенк,план,п,эт,знач"
"У Порошенко есть план ""П"" — что бы это значило (ВИДЕО)","порошенк,план,п,эт,знач,виде"
ЙАМУД,йамуд
Всадники апокалипсиса над Украиной,"всадник,апокалипсис,украин"
Сербы против томоса,"серб,прот,томос"
"ПЦУ нужно вспомнить, что они христиане!","пцу,нужн,вспомн,христианин"
Украинские раскольники отменят платки для женщин и начнут отпевать католиков,"украинск,раскольник,отменя,платок,женщин,начина,отпева,католик"
"ПЦУ нужно вспомнить, что они христиане!","пцу,нужн,вспомн,христианин"
Надувная свинка как символ радикальной революции,"надувн,свинк,символ,радикальн,революц"
"Украинские раскольники написали к выборам новую ""молитву""","украинск,раскольник,написа,выбор,нов,молитв"
В Сети раскритиковали Порошенко за передачу новой техники ВСУ,"сет,раскритиковыва,порошенк,передач,нов,техник,всу"
7 стран,стран
Порошенко обходится украинцам в миллиард гривен,"порошенк,обход,украинец,миллиард,гривн"
#такпобедим,такпобедим
ТОЛЬКО ПРИНУДИТЕЛЬНАЯ КАСТРАЦИЯ СО ВСЕМИ ВЫТЕКАЮЩИМИ ПОСЛЕДСТВИЯМИ,"принудительн,кастрац,ве,вытека,последств"
Современная Украина — закономерный итог мутации,"современ,украин,закономерн,итог,мутац"
Встреча с Порошенко: начались столкновения (+ФОТО,"встреч,порошенк,начина,столкновен,фот"
И вновь продолжается бой: на Украине яростно воюют с российскими книгами,"внов,продолжа,бо,украин,яростн,воева,российск,книг"
Вожди в балагане,"вожд,балага"
В Винницкой области раскольники напали на храм УПЦ,"винницк,област,раскольник,нападыва,храм,упц"
Главная интрига президентских выборов на Украине,"главн,интриг,президентск,выбор,украин"
ООН раскритиковала Украину за преследование православных верующих,"оон,раскритиковыва,украин,преследован,православн,вер"
"СБУ провела обыск у православного писателя Олега Слепынина за статьи с критикой ""томоса""","сбу,провод,обыск,православн,писател,олег,слепынин,стат,критик,томос"
Загоняется…,загоня
СБУ прессует противников томоса: в Черкассах прошёл обыск у писателя Олега Слепынина,"сбу,прессова,противник,томос,черкасс,прош,л,обыск,писател,олег,слепынин"
ООН в ужасе от религиозного конфликта на Украине,"оон,ужас,религиозн,конфликт,украин"
НОВЫЙ ПРЕЗИДЕНТ И НОВЫЙ ПРЕМЬЕР,"нов,президент,нов,премьер"
Почему американцы боятся украинских выборов,"поч,американец,боя,украинск,выбор"
Порошенко бегает от людей и от своего второго президентского срока,"порошенк,бега,человек,сво,втор,президентск,срок"
Мочит губы: Администрация Порошенко прокомментировала алкогольные пристрастия президента,"моч,губ,администрац,порошенк,прокомментирова,алкогольн,пристраст,президент"
"Представительство ""ПЦУ"" в Европарламенте закрыто после жалоб правозащитника","представительств,пцу,европарламент,закрыва,жалоб,правозащитник"
"Албанская православная церковь отказалась признавать раскольников из ""ПЦУ""","албанск,православн,церков,отказыва,признава,раскольник,пцу"
Порошенко отступил,"порошенк,отступа"
Добкин не исключил развитие психического расстройства у Порошенко,"добкин,исключа,развит,психическ,расстройств,порошенк"
Украинский Томос — капкан для мирового Православия,"украинск,томос,капка,миров,православ"
ЭТО ЕЩЕ НЕ ИТОГ ПРЕЗИДЕНТСТВА ПОРОШЕНКО,"эт,итог,президентств,порошенк"
Раскольник Епифаний пообещал помиловать священников канонической УПЦ после покаяния,"раскольник,епифан,пообеща,помилова,священник,каноническ,упц,покаян"
Варфоломей отказался обсуждать украинскую автокефалию с другими церквями,"варфолом,отказыва,обсужда,украинск,автокефал,церков"
УПЦ обвинила власти украинских городов в захвате православных церквей,"упц,обвиня,власт,украинск,город,захват,православн,церков"
Богдан Безпалько: Климкину стоит серьезно подтянуться по истории,"богда,беспальк,климкин,стоя,серьезн,подтягива,истор"
Отняли паспорт и со спецназом выслали в США: украинский епископ напишет Трампу про религиозный беспредел Киева,"отнима,паспорт,спецназ,высыла,сша,украинск,епископ,написа,трамп,религиозн,беспредел,ки"
ПОСЛЕДНИЕ СВОДКИ — 01.03.2019 (ОБНОВЛЯЕТСЯ!),"последн,сводк,обновля"
Сербская православная церковь объявила свою официальную позицию по Украине,"сербск,православн,церков,объявля,сво,официальн,позиц,украин"
Это случайность. В Администрации Порошенко пояснили,"эт,случайн,администрац,порошенк,поясня"
ВРАГ ПОПЫТАЛСЯ НАНЕСТИ УДАР В САМОЕ СВЯТОЕ МЕСТО,"враг,попыта,нанос,удар,сам,свят,мест"
MARUV – символ внутренней неонацистской оккупации Украины,"maruv,символ,внутрен,неонацистск,оккупац,украин"
ПОСЛЕДНИЕ СВОДКИ — 27.02.2019 (ОБНОВЛЯЕТСЯ!),"последн,сводк,обновля"
На Украине школьники будут сдавать экзамены по томосу,"украин,школьник,сдава,экзам,томос"
"Мясорубка: день ""Х"" настал","мясорубк,ден,х,настава"
ВЕНТИЛЯТОР НАБИРАЕТ ОБОРОТЫ,"вентилятор,набира,оборот"
ВЫ ТАМ СОВСЕМ С УМА ПОСХОДИЛИ?,"ум,посход"
Юрий Кнутов: Порошенко готов на всё ради президентского кресла,"юр,кнут,порошенк,готов,вс,рад,президентск,кресл"
MARUVгейт,марувгейт
"Итоги недели. ""Бандера не встал""","итог,недел,бандер,встава"
Русский экзархат в Западной Европе объявил о неповиновении Константинополю,"русск,экзархат,западн,европ,объявля,неповиновен,константинопол"
Националисты захватили еще одну церковь на Волыни,"националист,захват,церков,волын"
Камнем под глаз: На Волыни люди в масках атаковали храм УПЦ и травмировали прихожан,"камен,глаз,волын,человек,маск,атакова,храм,упц,травмирова,прихожанин"
"Поминки ""Небесной сотни"": ангелы из свечек","поминк,небесн,сотн,ангел,свечк"
"Александр Дмитриевский: ""ПЦУ"" сделает Украину католической страной","александр,дмитриевск,пцу,сдела,украин,католическ,стран"
Порошенко и выборы: забвение и электоральный тлен?,"порошенк,выбор,забвен,электоральн,тлен"
"Мировой тренд: ""код Порошенко"" и уличные бунты","миров,тренд,код,порошенк,уличн,бунт"
Религиозная война на Украине: католики-униаты готовятся служить в Киевской Софии,"религиозн,войн,украин,католик,униат,готов,служ,киевск,соф"
ПЕТР АЛЕКСЕЕВИЧ УЖЕ НАЧИНАЕТ ПИАРИТЬСЯ НА ПУТИНЕ,"петр,алексеевич,начина,пиар,путин"
Валерий Скороходов: СБУ обвиняет спецслужбы РФ в нападении на храмы УПЦ,"валер,скороход,сбу,обвиня,спецслужб,рф,нападен,храм,упц"
Ложь и террор режима не исцелят Украину,"лож,террор,реж,исцеля,украин"
Обострение на Донбассе: Порошенко решил развязать войну для выборов,"обострен,донбасс,порошенк,реша,развязыва,войн,выбор"
"Нацистские корни украинской ""автокефалии""","нацистск,корен,украинск,автокефал"
"Киевляне увидели в ""томос-туре"" Порошенко предвыборную агитацию","киевлянин,увидет,томос,тур,порошенк,предвыборн,агитац"
В Порошенко вживили загадочную штуку (ФОТО),"порошенк,вживля,загадочн,штук,фот"
Вероломное вторжение на чужую землю: в Болгарской Церкви обвинили Варфоломея в пособничестве властям Украины,"вероломн,вторжен,чуж,земл,болгарск,церков,обвиня,варфолом,пособничеств,власт,украин"
Томос для Киевского патриархата: Говорим ПЦУ,"томос,киевск,патриархат,говор,пцу"
ЧТО ПРОИЗОШЛО СО ШКУРОЙ ГОРНОГО КОЗЛА?,"происход,шкур,горн,козел"
Тимошенко возвращает себе лидерство. Ход за Порошенко,"тимошенк,возвраща,лидерств,ход,порошенк"
Итоги недели. От самовыдвинутого Порошенко до самоинтронизированного Думенко,"итог,недел,самовыдвига,порошенк,самоинтронизирова,думенк"
"Операция ""Интронизация"": Епифаний и пустота","операц,интронизац,епифан,пустот"
"Варфоломей не приехал на ""интронизацию"" главы украинских раскольников","варфолом,приезжа,интронизац,глав,украинск,раскольник"
Инфарктная интронизация: в Украине узаконен главный раскольник,"инфарктн,интронизац,украин,узаконива,главн,раскольник"
"Операция ""Анти-Афон"": Константинопольский патриархат дискредитирует святогорцев","операц,ант,афон,константинопольск,патриархат,дискредитирова,святогорец"
"ЭМИССАРЫ АДЕПТА ""ХОЛОДНОГО МИРА"" ЛЕЗУТ ВО ВСЕ ЩЕЛИ","эмиссар,адепт,холодн,мир,лезт,ве,щел"
Варфоломей пропустит интронизацию Епифания в Киеве - СМИ,"варфолом,пропуска,интронизац,епифан,ки,сми"
"Фанар не добился от Грузинской церкви признания ""украинской автокефалии""","фанар,добива,грузинск,церков,признан,украинск,автокефал"
Патриарх Московский и всея Руси Кирилл собрался в Киев,"патриарх,московск,ве,ру,кирилл,собира,ки"
Религиозные диверсанты рвутся в Россию,"религиозн,диверсант,рват,росс"
Православная церковь США отказалась признать ПЦУ,"православн,церков,сша,отказыва,признава,пцу"
Самовисування. Куда ходят избиратели Украины,"самовисуван,ход,избирател,украин"
Православная церковь Америки отказалась признать ПЦУ,"православн,церков,америк,отказыва,признава,пцу"
Эксперт: Украина разорвёт дипотношения с РФ — это желание США,"эксперт,украин,разорв,т,дипотношен,рф,эт,желан,сша"
"Украина. ""Жила грешно и умерла смешно""","украин,жит,грешн,умира,смешн"
Афонские святогорцы отказались участвовать в интронизации главы ПЦУ,"афонск,святогорец,отказыва,участвова,интронизац,глав,пцу"
Без приходов нет доходов: за что борются украинские раскольники,"приход,доход,борот,украинск,раскольник"
Червоненко: Томос уже используют для подкупа избирателей,"червоненк,томос,использова,подкуп,избирател"
"Три задачи слабеющей Тимошенко в борьбе с ""Томосоносом""","задач,слабет,тимошенк,борьб,томосонос"
Кровопролитие и большие жертвы: Томос разбивает Украину на части — эксперт,"кровопролит,больш,жертв,томос,разбива,украин,част,эксперт"
Итоги недели. Рост российского импорта и ворованные шапки Давоса,"итог,недел,рост,российск,импорт,ворова,шапк,давос"
Брюки в носках,"брюк,носок"
Эксперт констатировал зарождение кризиса между Константинополем и украинскими раскольниками,"эксперт,констатирова,зарожден,кризис,константинопол,украинск,раскольник"
"Украина. ""Жила грешно и умерла смешно""","украин,жит,грешн,умира,смешн"
"Украина. ""Жила грешно и умерла смешно"" (ВИДЕО)","украин,жит,грешн,умира,смешн,виде"
Украинские выборы разрушат хрупкий мир в стране,"украинск,выбор,разруша,хрупк,мир,стран"
ВЕНЕСУЭЛА ПО-УКРАИНСКИ,"венесуэл,украинск"
Бортник: Никто не знает,"бортник,никт,знат"
"Украина: ""венесуэльский вариант""","украин,венесуэльск,вариант"
ЗАВТРАК В ДАВОСЕ ПРЕВРАТИЛСЯ В СКАНДАЛ,"завтрак,давос,превраща,сканда"
Пропагандисты Майдана жалуются,"пропагандист,майда,жалова"
Армия геев: Украинские военнослужащие признаются в своей гомосексуальности.,"арм,ге,украинск,военнослужа,признава,сво,гомосексуальн"
ПЦУ-то ненастоящая: Порошенко и Варфоломей нарушили вселенские каноны,"пцу,ненастоя,порошенк,варфолом,наруша,вселенск,канон"
Порошенко сливают: ведущие европейские СМИ начали высмеивать украинского президента (ВИДЕО),"порошенк,слива,ведущ,европейск,сми,начина,высмеива,украинск,президент,виде"
ПОСЛЕДНИЕ СВОДКИ — 23.01.2019 (ОБНОВЛЯЕТСЯ!),"последн,сводк,обновля"
Со своим томосом: Тимошенко идёт в президенты,"сво,томос,тимошенк,ид,т,президент"
"В надежде на чудо Порошенко отправился в ""томос-тур"" по Украине","надежд,чуд,порошенк,отправля,томос,тур,украин"
Пропагандист Гордон объявил себя обманутым украинскими властями,"пропагандист,гордон,объявля,обманыва,украинск,власт"
Изменится ли Украина после поражения Порошенко на выборах? (ФОТО),"изменя,украин,поражен,порошенк,выбор,фот"
Томос о зависимости: куда сгоняют православных украинцев,"томос,зависим,сгоня,православн,украинец"
Плевать на твой томос: Неонацисты угрожают будущему Порошенко,"плева,тво,томос,неонацист,угрожа,будущ,порошенк"
Вячеслав Сальников: От выборов на Украине ждать нечего – русское политическое поле в стране не просто зачищено,"вячесла,сальник,выбор,украин,ждат,неч,русск,политическ,пол,стран,прост,зачища"
Порошенко испугался разрывать договор с Россией о Керченском проливе,"порошенк,испуга,разрыва,договор,росс,керченск,прол"
Порошенко стал самым наглым вором в истории Украины: масштаб разграбления колоссален,"порошенк,станов,сам,нагл,вор,истор,украин,масштаб,разграблен,колоссальн"
Интронизация главного украинского раскольника Епифания состоится в древнейшем русском соборе,"интронизац,главн,украинск,раскольник,епифан,состоя,древн,русск,собор"
Мы не боимся тебя,боя
"В коррупции на Украине виноваты ""москали"" и Тимошенко","коррупц,украин,виноват,москал,тимошенк"
Новые провокации. В сумском соборе прогремел взрыв,"нов,провокац,сумск,собор,прогремет,взрыв"
Порошенко выходит на тропу предвыборной войны,"порошенк,выход,троп,предвыборн,войн"
Держиморда прилюдно обгадилась,"держиморд,прилюдн,обгажива"
Обыкновенный нацизм. Переформатирование сознания украинцев в действии,"обыкновен,нацизм,переформатирован,сознан,украинец,действ"
"Порошенко хочет наказать волынских депутатов за неудачные гастроли во время ""томос-тура""","порошенк,хотет,наказыва,волынск,депутат,неудачн,гастрол,врем,томос,тур"
Порошенко грубо оскорбил жителя Черкасс за вопрос о коррупции,"порошенк,груб,оскорбля,жител,черкасс,вопрос,коррупц"
Обыкновенный нацизм. Переформатирование сознания украинцев в действии,"обыкновен,нацизм,переформатирован,сознан,украинец,действ"
"Кто против коррупции — тот ""москальский провокатор""","прот,коррупц,москальск,провокатор"
Донбасс - это Украина: Николай Стариков разъяснил,"донбасс,эт,украин,никола,старик,разъясня"
Почему Москва не отреагировала на убийство Захарченко и почему жителям Донбасса необходимо гражданство РФ - Стариков,"поч,москв,отреагирова,убийств,захарченк,поч,жител,донбасс,необходим,гражданств,рф,старик"
Взрыв в полицейской академии в Боготе: погибло 20 человек,"взрыв,полицейск,академ,богот,погиба,человек"
"В 2020 году ""Газпром"" прекращает транзита газа через Украину","год,газпр,прекраща,транз,газ,украин"
