NAME,TOKENS
Эксперт: Власть не знает,"эксперт,власт,знат"
"Золотарев: Проект ""томос"" был создан на деньги криминальной днепропетровской ""братвы""","золотар,проект,томос,создава,деньг,криминальн,днепропетровск,братв"
Политолог: Томос - разновидность административного ресурса,"политолог,томос,разновидн,административн,ресурс"
Полный томос,"полн,томос"
Рождество готовятся отмечать на Украине,"рождеств,готов,отмеча,украин"
Кум Порошенко сравнил томос с паспортом,"кум,порошенк,сравнива,томос,паспорт"
Митрополит Киевский Епифаний получит сегодня грамоту о независимости Православной церкви Украины,"митропол,киевск,епифан,получа,сегодн,грамот,независим,православн,церков,украин"
Константинопольский патриарх сегодня вручит томос об автокефалии предстоятелю новой украинской церкви Епифанию,"константинопольск,патриарх,сегодн,вруча,томос,автокефал,предстоятел,нов,украинск,церков,епифан"
Митрополит Киевский Епифаний получит сегодня грамоту о независимости Православной церкви Украины,"митропол,киевск,епифан,получа,сегодн,грамот,независим,православн,церков,украин"
Митрополит Киевский Епифаний получит сегодня грамоту о независимости Православной церкви Украины,"митропол,киевск,епифан,получа,сегодн,грамот,независим,православн,церков,украин"
В Стамбуле сегодня вручат томос об автокефалии украинской церкви,"стамбул,сегодн,вруча,томос,автокефал,украинск,церков"
Порошенко обнародовал текст томоса об автокефалии украинской церкви,"порошенк,обнародова,текст,томос,автокефал,украинск,церков"
Митрополит Киевский Епифаний получит сегодня грамоту о независимости Православной церкви Украины,"митропол,киевск,епифан,получа,сегодн,грамот,независим,православн,церков,украин"
Порошенко показал томос об автокефалии украинской церкви,"порошенк,показыва,томос,автокефал,украинск,церков"
Ющенко рассказал,"ющенк,рассказыва"
В Стамбуле сегодня вручат томос об автокефалии украинской церкви,"стамбул,сегодн,вруча,томос,автокефал,украинск,церков"
Эксперты оценили,"эксперт,оценива"
"Глава БПЦ назвал подписание томоса для Украины ""политической авантюрой""","глав,бпц,называ,подписан,томос,украин,политическ,авантюр"
В Стамбуле в Храме Святого Георгия вместо молитвы президент Украины произнес пылкую речь,"стамбул,храм,свят,георг,вмест,молитв,президент,украин,произнос,пылк,реч"
Порошенко,порошенк
Появилась фотография грамоты о независимости,"появля,фотограф,грамот,независим"
Константинопольский патриархат прирезал часть украинской церкви,"константинопольск,патриархат,приреза,част,украинск,церков"
Порошенко поставил православную церковь на грань многолетнего раскола,"порошенк,поставля,православн,церков,гран,многолетн,раскол"
"Дочки-матери: Варфоломей указал на ""мачеху"" украинской церкви","дочк,мат,варфолом,указыва,мачех,украинск,церков"
"В Московском патриархате заявили о нарушении всех православных канонов при подписании томоса для ""новой церкви"" Украины","московск,патриархат,заявля,нарушен,ве,православн,канон,подписан,томос,нов,церков,украин"
Парубий резко высказался о переименовании канонической УПЦ,"паруб,резк,высказыва,переименован,каноническ,упц"
Выпуск новостей в 18:00 от 05.01.2019,"выпуск,новост"
Поклонская: На Украине больше нет свободы вероисповедания,"поклонск,украин,свобод,вероисповедан"
В администрации Порошенко утверждают,"администрац,порошенк,утвержда"
"СЦУ - это не то, что вы подумали: Название новой церкви Украины взорвало Сеть","сцу,эт,подума,назван,нов,церков,украин,взрыва,сет"
Каноническое бессилие: что означает подписание томоса для Украины и православия,"каноническ,бессил,означа,подписан,томос,украин,православ"
Петр Порошенко с помпой приехал в Константинопольский патриархат за автокефалией для раскольников,"петр,порошенк,помп,приезжа,константинопольск,патриархат,автокефал,раскольник"
Патриарх Варфоломей подписал томос для украинской церкви,"патриарх,варфолом,подписыва,томос,украинск,церков"
"Константинополь назвал РПЦ ""мачехой"" и обязался поддерживать украинскую церковь","константинопол,называ,рпц,мачех,обязыва,поддержива,украинск,церков"
Порошенко и Варфоломей наградили друг друга,"порошенк,варфолом,награжда,друг,друг"
Порошенко и патриарх Варфоломей вручили друг другу награды,"порошенк,патриарх,варфолом,вруча,друг,друг,наград"
Что означает подписанный томос об автокефалии православной церкви Украины?,"означа,подписыва,томос,автокефал,православн,церков,украин"
Радикалы готовят провокации возле собора в Чернигове - УПЦ,"радика,готов,провокац,возл,собор,черниг,упц"
"Иерарх патриархата в Стамбуле назвал предоставление томоса ПЦУ ""политической сделкой""","иерарх,патриархат,стамбул,называ,предоставлен,томос,пцу,политическ,сделк"
В РПЦ заявили,"рпц,заявля"
Слуцкий: подписание томоса для так называемой ПЦУ усугубит раскол православия на Украине,"слуцк,подписан,томос,называ,пцу,усугубля,раскол,православ,украин"
Константинопольский патриарх Варфоломей подписал томос об автокефалии православной церкви Украины,"константинопольск,патриарх,варфолом,подписыва,томос,автокефал,православн,церков,украин"
Константинопольский патриарх Варфоломей подписал указ о независимости Православной церкви Украины,"константинопольск,патриарх,варфолом,подписыва,указ,независим,православн,церков,украин"
Вселенский Патриарх подписал документ о независимости Православной церкви Украины,"вселенск,патриарх,подписыва,документ,независим,православн,церков,украин"
"В РПЦ назвали томос для украинской церкви ""попыткой украсть Рождество""","рпц,называ,томос,украинск,церков,попытк,украст,рождеств"
Порошенко опубликовал текст томоса об автокефалии украинской церкви,"порошенк,опубликовыва,текст,томос,автокефал,украинск,церков"
Скубченко: Власти Украины продали суверенитет Вашингтону,"скубченк,власт,украин,продава,суверенитет,вашингтон"
Томос об автокефалии православной церкви Украины подписан,"томос,автокефал,православн,церков,украин,подписыва"
В Виннице общину храма канонической церкви выселили из-за отказа переходить в ПЦУ,"винниц,общин,храм,каноническ,церков,выселя,отказ,переход,пцу"
В Виннице выселили общину храма Александра Невского,"винниц,выселя,общин,храм,александр,невск"
В Госдуме прокомментировали подписание томоса об автокефалии ПЦУ,"госдум,прокомментирова,подписан,томос,автокефал,пцу"
"Константинопольский патриарх Варфоломей подписал томос автокефалии ""новой церкви"" Украины","константинопольск,патриарх,варфолом,подписыва,томос,автокефал,нов,церков,украин"
"В УПЦ назвали нарушением всех возможных правил предоставление автокефалии ""новой церкви"" Украины","упц,называ,нарушен,ве,возможн,прав,предоставлен,автокефал,нов,церков,украин"
"Константинополь призвал называть ПЦУ ""Святейшей церковью Украины""","константинопол,призыва,называ,пцу,свят,церков,украин"
"Патриарх Варфоломей подписал томос об автокефалии ""новой церкви"" Украины","патриарх,варфолом,подписыва,томос,автокефал,нов,церков,украин"
Легойда: подписанный томос не обладает канонической силой,"легойд,подписыва,томос,облада,каноническ,сил"
Новая деспотия: никто не знает,"нов,деспот,никт,знат"
Косачев назвал подписание томоса патриархом Варфоломеем политическим актом,"косач,называ,подписан,томос,патриарх,варфолом,политическ,акт"
Случаи захвата российских моряков в заложники с 2010 года,"случа,захват,российск,моряк,заложник,год"
Депутат назвал подписание томоса для Украины наглым шагом при поддержке США,"депутат,называ,подписан,томос,украин,нагл,шаг,поддержк,сша"
"Порошенко наградил Варфоломея орденом ""За заслуги"" первой степени и получил от него медаль","порошенк,награжда,варфолом,орд,заслуг,перв,степен,получа,медал"
Константинопольский патриархат предоставил автокефалию Украинской православной церкви,"константинопольск,патриархат,предоставля,автокефал,украинск,православн,церков"
Вселенский патриарх Варфоломей подписал томос о предоставлении автокефалии православной церкви Украины,"вселенск,патриарх,варфолом,подписыва,томос,предоставлен,автокефал,православн,церков,украин"
Легойда: Томос – бумага,"легойд,томос,бумаг"
В РПЦ прокомментировали томос об автокефалии ПЦУ,"рпц,прокомментирова,томос,автокефал,пцу"
Томос об автокефалии украинской православной церкви подписан в Стамбуле,"томос,автокефал,украинск,православн,церков,подписыва,стамбул"
Вселенский патриарх подписал томос об автокефалии украинской церкви,"вселенск,патриарх,подписыва,томос,автокефал,украинск,церков"
УПЦ заявила,"упц,заявля"
В РПЦ заявили,"рпц,заявля"
Легойда: подписанный в Стамбуле томос для Украины не обладает канонической силой,"легойд,подписыва,стамбул,томос,украин,облада,каноническ,сил"
Попытки создания автокефальной православной церкви на Украине,"попытк,создан,автокефальн,православн,церков,украин"
Порошенко назвал подписание томоса об автокефалии ПЦУ историческим событием,"порошенк,называ,подписан,томос,автокефал,пцу,историческ,событ"
Патриарх Варфоломей подписал томос об автокефалии ПЦУ,"патриарх,варфолом,подписыва,томос,автокефал,пцу"
Патриарх Варфоломей подписал указ об украинской автокефалии,"патриарх,варфолом,подписыва,указ,украинск,автокефал"
"В РПЦ назвали подписанный в Стамбуле томос ""бумагой""","рпц,называ,подписыва,стамбул,томос,бумаг"
УПЦ: Предоставление автокефалии украинским раскольникам нарушает все апостольские правила,"упц,предоставлен,автокефал,украинск,раскольник,наруша,ве,апостольск,прав"
Томос для Киева: Варфоломей подписал духовную капитуляцию,"томос,ки,варфолом,подписыва,духовн,капитуляц"
Патриарх Варфоломей подписал томос для ПЦУ,"патриарх,варфолом,подписыва,томос,пцу"
В Стамбуле подписали томос для неканонической церкви Украины,"стамбул,подписыва,томос,неканоническ,церков,украин"
"Томос для украинской ""новой церкви"" подписан патриархом Варфоломеем","томос,украинск,нов,церков,подписыва,патриарх,варфолом"
Патриарх Варфоломей подписал томос об автокефалии Православной церкви Украины,"патриарх,варфолом,подписыва,томос,автокефал,православн,церков,украин"
Константинопольский патриарх Варфоломей подписал томос об автокефалии Православной церкви Украины,"константинопольск,патриарх,варфолом,подписыва,томос,автокефал,православн,церков,украин"
Патриарх Варфоломей в храме святого Георгия в Стамбуле подписал томос об автокефалии Православной церкви Украины,"патриарх,варфолом,храм,свят,георг,стамбул,подписыва,томос,автокефал,православн,церков,украин"
Патриарх Варфоломей подписал томос об автокефалии для украинской церкви,"патриарх,варфолом,подписыва,томос,автокефал,украинск,церков"
Украина перед Томосом. Эфир в 17:05,"украин,томос,эфир"
Парубий внесет в Верховную Раду законопроект о юридической процедуре перехода общин в ПЦУ,"паруб,внос,верховн,рад,законопроект,юридическ,процедур,переход,общин,пцу"
Варфоломей подписал томос,"варфолом,подписыва,томос"
Патриарх Варфоломей подписал томос для новой украинской церковной структуры,"патриарх,варфолом,подписыва,томос,нов,украинск,церковн,структур"
Константинопольский патриарх подписал томос об украинской автокефалии,"константинопольск,патриарх,подписыва,томос,украинск,автокефал"
Конфликт церквей: действующие лица,"конфликт,церков,действ,лиц"
"Варфоломей попросил поддержки в признании ""новой церкви"" на Украине","варфолом,попрос,поддержк,признан,нов,церков,украин"
Украинская делегация приехала в Стамбул за томосом,"украинск,делегац,приезжа,стамбул,томос"
Экзарх Белоруссии: Украинский томос – трагедия всеправославного масштаба,"экзарх,белорусс,украинск,томос,трагед,всеправославн,масштаб"
Патриарх Варфоломей подписывает томос об украинской автокефалии,"патриарх,варфолом,подписыва,томос,украинск,автокефал"
В Стамбуле обещают сегодня подписать Томос об автокефалии раскольнической церкви Украины,"стамбул,обеща,сегодн,подписыва,томос,автокефал,раскольническ,церков,украин"
УПЦ уволила настоятеля и клириков собора в Днепропетровской области за поддержку томоса,"упц,увольня,настоятел,клирик,собор,днепропетровск,област,поддержк,томос"
Порошенко вылетел в Стамбул за томосом,"порошенк,вылета,стамбул,томос"
Патриарх Константинопольский Варфоломей сегодня подпишет Томос об автокефалии Украинской церкви,"патриарх,константинопольск,варфолом,сегодн,подписыва,томос,автокефал,украинск,церков"
Патриарх Вселенской православной церкви Варфоломей поставит свою подпись под Томосом об автокефалии Украинской церкви,"патриарх,вселенск,православн,церков,варфолом,поставля,сво,подп,томос,автокефал,украинск,церков"
Варфоломей требует от православных церквей признать ПЦУ,"варфолом,требова,православн,церков,признава,пцу"
Раскольники планируют выставить томос на всеобщее обозрение в Киеве,"раскольник,планирова,выставля,томос,всеобщ,обозрен,ки"
Z Персонально ваш Все выпуски,"z,персональн,ваш,ве,выпуск"
Процедура предоставления Вселенским патриархом Томоса об автокефалии Православной церкви Украины начнется сегодня,"процедур,предоставлен,вселенск,патриарх,томос,автокефал,православн,церков,украин,начина,сегодн"
В Стамбуле начинается процедура предоставления томоса об автокефалии ПЦУ,"стамбул,начина,процедур,предоставлен,томос,автокефал,пцу"
Патриарх Вселенской православной церкви Варфоломей поставит свою подпись под Томосом об автокефалии Украинской церкви,"патриарх,вселенск,православн,церков,варфолом,поставля,сво,подп,томос,автокефал,украинск,церков"
"Глава ""новой церкви"" Украины пообещал выставить на обозрение ""томос автокефалии""","глав,нов,церков,украин,пообеща,выставля,обозрен,томос,автокефал"
Предстоятель ПЦУ митрополит Киевский и всея Украины Епифаний 7-го января совершит литургию в соборе Святой Софии,"предстоятел,пцу,митропол,киевск,ве,украин,епифан,го,январ,соверша,литург,собор,свят,соф"
Варфоломей напомнил о Судном дне главам поместных церквей,"варфолом,напомина,судн,ден,глав,поместн,церков"
"Патриарх Варфоломей попросил поддержки в признании ""новой церкви"" на Украине","патриарх,варфолом,попрос,поддержк,признан,нов,церков,украин"
Варфоломей призвал к признанию украинской автокефалии,"варфолом,призыва,признан,украинск,автокефал"
Порошенко завтра едет в Турцию,"порошенк,завтр,еха,турц"
"Украина за шаг до ""томоса""","украин,шаг,томос"
Интриги и коварство. Новая церковь на Украине накануне получения томоса,"интриг,коварств,нов,церков,украин,наканун,получен,томос"
